{
  "ir_version": "1.0",
  "record_id": "paper12.network-f3-learned.v2",
  "record_kind": "diagnostic_analogue",
  "manifest_ref": {
    "manifest_id": "paper12.network-f3-learned.v2",
    "manifest_version": "1.0",
    "artifact_id": "artifact.manifest",
    "digest": {
      "algorithm": "sha256",
      "value": "9f98ca6f9fd0c8a99c303ede007d7bef8c35b4de13047d538e313c7217735b0f"
    }
  },
  "source": {
    "adapter_id": "paper12-v1-to-v2",
    "adapter_version": "2.0",
    "source_id": "paper12.network-f3-learned.v1",
    "artifact_ids": [
      "artifact.legacy",
      "artifact.producer"
    ]
  },
  "objects": [
    {
      "id": "analogue.record",
      "kind": "diagnostic_analogue",
      "label": "Provenance-bound diagnostic analogue",
      "provenance_artifact_ids": [
        "artifact.legacy"
      ],
      "carrier_id": "carrier.analogue",
      "data": {
        "sector_descriptor": {
          "origin": "one-hot prefix sectors",
          "prefixes": [
            "P0(local)",
            "P1(dmz)",
            "P2(internal)",
            "P3(external)"
          ],
          "sector_count": 4,
          "strict_sof_realization": true
        },
        "observable_descriptor": {
          "observables": [
            "X_internal (with spurious P0->P3)",
            "X_external"
          ]
        },
        "support_descriptor": {
          "kind": "word-generator direct support",
          "matrix": [
            [
              0,
              1,
              1,
              1
            ],
            [
              1,
              0,
              1,
              1
            ],
            [
              1,
              1,
              0,
              1
            ],
            [
              1,
              1,
              1,
              0
            ]
          ],
          "offdiag_count": 12
        },
        "bridge_descriptor": {
          "word": {
            "matrix": [
              [
                0,
                1,
                1,
                1
              ],
              [
                1,
                0,
                1,
                1
              ],
              [
                1,
                1,
                0,
                1
              ],
              [
                1,
                1,
                1,
                0
              ]
            ],
            "offdiag_count": 12
          },
          "lie": {
            "matrix": [
              [
                0,
                1,
                1,
                1
              ],
              [
                1,
                0,
                0,
                1
              ],
              [
                1,
                0,
                0,
                0
              ],
              [
                1,
                1,
                0,
                0
              ]
            ],
            "offdiag_count": 8
          },
          "claim_note": "word and Lie bridge channels are recorded separately"
        },
        "repair_descriptor": {
          "kind": "word-depth accessibility summary",
          "depth_matrix": [
            [
              0,
              1,
              1,
              1
            ],
            [
              1,
              0,
              1,
              1
            ],
            [
              1,
              1,
              0,
              1
            ],
            [
              1,
              1,
              1,
              0
            ]
          ],
          "max_finite_depth": 1,
          "frozen_R1": 0,
          "frozen_D_word": 0,
          "frozen_D_lie": 0
        },
        "wall_descriptor": null,
        "analogue_mapping": "The report is migrated from a frozen Paper XIII SOFRS v1 envelope into the Paper XII v2 CompilerOutput-bound report contract."
      }
    }
  ],
  "carriers": [
    {
      "id": "carrier.analogue",
      "kind": "analogue",
      "capability_id": "diagnostic_analogue",
      "semantics": "Descriptor-level support, bridge, repair, and wall analogues.",
      "object_ids": [
        "analogue.record"
      ],
      "semantic_convention_ids": []
    }
  ],
  "semantic_conventions": [],
  "run_policies": [],
  "artifacts": [
    {
      "id": "artifact.manifest",
      "uri": "experiments/paper13/results/source-reports/manifests/network_f3_learned.capabilities.json",
      "digest": {
        "algorithm": "sha256",
        "value": "9f98ca6f9fd0c8a99c303ede007d7bef8c35b4de13047d538e313c7217735b0f"
      },
      "media_type": "application/json",
      "schema_version": "1.0",
      "role": "manifest"
    },
    {
      "id": "artifact.legacy",
      "uri": "experiments/paper13/archive/results/network_f3_learned.sofreport",
      "digest": {
        "algorithm": "sha256",
        "value": "c095b54bdfeb67a951ba3d45d3f7816d9532e646ec771731d860d5523f24a626"
      },
      "media_type": "application/json",
      "schema_version": "1.0",
      "role": "source-input"
    },
    {
      "id": "artifact.producer",
      "uri": "experiments/paper13/network_routing_sof.py",
      "digest": {
        "algorithm": "sha256",
        "value": "3c28d18496223921630f249edecc632108a5a2a59702af484eed04b4b7f7c425"
      },
      "media_type": "text/x-python",
      "schema_version": "1.0",
      "role": "proof-reference"
    }
  ],
  "certificates": [],
  "findings": [
    {
      "id": "finding.analogue",
      "kind": "status_only",
      "carrier_id": "carrier.analogue",
      "subject_object_ids": [
        "analogue.record"
      ],
      "value": {
        "sector_descriptor": {
          "origin": "one-hot prefix sectors",
          "prefixes": [
            "P0(local)",
            "P1(dmz)",
            "P2(internal)",
            "P3(external)"
          ],
          "sector_count": 4,
          "strict_sof_realization": true
        },
        "observable_descriptor": {
          "observables": [
            "X_internal (with spurious P0->P3)",
            "X_external"
          ]
        },
        "support_descriptor": {
          "kind": "word-generator direct support",
          "matrix": [
            [
              0,
              1,
              1,
              1
            ],
            [
              1,
              0,
              1,
              1
            ],
            [
              1,
              1,
              0,
              1
            ],
            [
              1,
              1,
              1,
              0
            ]
          ],
          "offdiag_count": 12
        },
        "bridge_descriptor": {
          "word": {
            "matrix": [
              [
                0,
                1,
                1,
                1
              ],
              [
                1,
                0,
                1,
                1
              ],
              [
                1,
                1,
                0,
                1
              ],
              [
                1,
                1,
                1,
                0
              ]
            ],
            "offdiag_count": 12
          },
          "lie": {
            "matrix": [
              [
                0,
                1,
                1,
                1
              ],
              [
                1,
                0,
                0,
                1
              ],
              [
                1,
                0,
                0,
                0
              ],
              [
                1,
                1,
                0,
                0
              ]
            ],
            "offdiag_count": 8
          },
          "claim_note": "word and Lie bridge channels are recorded separately"
        },
        "repair_descriptor": {
          "kind": "word-depth accessibility summary",
          "depth_matrix": [
            [
              0,
              1,
              1,
              1
            ],
            [
              1,
              0,
              1,
              1
            ],
            [
              1,
              1,
              0,
              1
            ],
            [
              1,
              1,
              1,
              0
            ]
          ],
          "max_finite_depth": 1,
          "frozen_R1": 0,
          "frozen_D_word": 0,
          "frozen_D_lie": 0
        },
        "wall_descriptor": null,
        "analogue_mapping": "The report is migrated from a frozen Paper XIII SOFRS v1 envelope into the Paper XII v2 CompilerOutput-bound report contract."
      },
      "unit": null,
      "result_state": "OBSERVED",
      "semantic_convention_ids": [],
      "run_policy_ids": [],
      "certificate_ids": [],
      "artifact_ids": [
        "artifact.legacy"
      ]
    }
  ],
  "claims": [
    {
      "id": "claim.analogue",
      "statement": "The source artifact supports a provenance-bound structurally analogous diagnostic under the declared mapping.",
      "result_state": "OBSERVED",
      "claim_status": "Computational Observation",
      "capability_ids": [
        "diagnostic_analogue"
      ],
      "carrier_ids": [
        "carrier.analogue"
      ],
      "object_ids": [
        "analogue.record"
      ],
      "finding_ids": [
        "finding.analogue"
      ],
      "semantic_convention_ids": [],
      "run_policy_ids": [],
      "hypotheses": [
        "The frozen v1 report, adapter classification, and declared policies are fixed."
      ],
      "certificate_ids": [],
      "artifact_ids": [
        "artifact.legacy"
      ],
      "scope": "Descriptor-level Paper XII control network_f3_learned.sofreport.",
      "negative_boundary": "This v2 source report preserves the finite source envelope; it does not establish an independent object-level oracle or cross-report semantic alignment."
    }
  ],
  "derivations": []
}
